<?xml version="1.0" encoding="UTF-8" standalone="yes"?>
<!--W3C Schema generated by XMLSpy v2005 sp1 U (http://www.xmlspy.com)-->
<xs:schema xmlns:xs="http://www.w3.org/2001/XMLSchema" elementFormDefault="qualified">
	<xs:element name="apidoc">
		<xs:complexType>
			<xs:sequence>
				<xs:element ref="function" maxOccurs="unbounded"/>
			</xs:sequence>
			<xs:attribute name="version" use="required">
				<xs:simpleType>
					<xs:restriction base="xs:string" />
				</xs:simpleType>
			</xs:attribute>
		</xs:complexType>
	</xs:element>
	<xs:element name="argument">
		<xs:complexType>
			<xs:sequence>
				<xs:element ref="summary"/>
			</xs:sequence>
			<xs:attribute name="name" use="required">
				<xs:simpleType>
					<xs:restriction base="xs:string"/>
				</xs:simpleType>
			</xs:attribute>
			<xs:attribute name="type" use="required">
				<xs:simpleType>
					<xs:restriction base="xs:string"/>
				</xs:simpleType>
			</xs:attribute>
			<xs:attribute name="optional">
				<xs:simpleType>
					<xs:restriction base="xs:boolean"/>
				</xs:simpleType>
			</xs:attribute>
		</xs:complexType>
	</xs:element>
	<xs:element name="arguments">
		<xs:complexType>
			<xs:sequence>
				<xs:element ref="argument" minOccurs="0" maxOccurs="unbounded"/>
			</xs:sequence>
		</xs:complexType>
	</xs:element>
	<xs:element name="context">
		<xs:complexType>
			<xs:attribute name="type" use="required">
				<xs:simpleType>
					<xs:restriction base="xs:string"/>
				</xs:simpleType>
			</xs:attribute>
		</xs:complexType>
	</xs:element>
	<xs:element name="function">
		<xs:complexType>
			<xs:sequence>
				<xs:element ref="context" minOccurs="0"/>
				<xs:element ref="table" minOccurs="0"/>
				<xs:element ref="summary"/>
				<xs:element ref="return" minOccurs="0"/>
				<xs:element ref="arguments" minOccurs="0"/>
			</xs:sequence>
			<xs:attribute name="name" use="required">
				<xs:simpleType>
					<xs:restriction base="xs:string"/>
				</xs:simpleType>
			</xs:attribute>
		</xs:complexType>
	</xs:element>
	<xs:element name="return">
		<xs:complexType>
			<xs:attribute name="type" use="required">
				<xs:simpleType>
					<xs:restriction base="xs:string"/>
				</xs:simpleType>
			</xs:attribute>
		</xs:complexType>
	</xs:element>
	<xs:element name="summary" type="xs:string"/>
	<xs:element name="table">
		<xs:complexType>
			<xs:attribute name="name" use="required">
				<xs:simpleType>
					<xs:restriction base="xs:string"/>
				</xs:simpleType>
			</xs:attribute>
		</xs:complexType>
	</xs:element>
</xs:schema>
